<?xml version="1.0" encoding="utf-8"?>
<!-- SVG to XGAME xml converter v1.6.07 -->
<!-- source: D:\Lunohod\Levels\Lvl_Poezd_v2\Lvl_Poezd_v2.svg -->
<Level xmlns:xsi="http://www.w3.org/2001/XMLSchema-instance" xsi:noNamespaceSchemaLocation="file:///D:/Lunohod/Documentation/schema0.xsd" Name="Lvl_Poezd_v2" Bounds="0, 0, 480, 320">
    <Include File="ClassEnemyRat4.xml" />
    <Include File="ClassFoodFish1.xml" />
    <Include File="ClassTower.xml" />
    <Include File="ClassHero.xml" />
    <Include File="ClassExit.xml" />
    <Resources RootFolder="Textures">
        <Texture Id="txr_backg_demo" Source="backg_demo" />
        <Texture Id="txr_railway2" Source="railway2" />
        <Texture Id="txr_semafor_green" Source="semafor_green" />
    </Resources>
    <Layer Id="background" BackColor="#FFFFFFFF">
        <Image Id="dfltMask1" TextureId="txr_backg_demo" Bounds="0, 0, 480, 320" TraceId="image4744"/>
        <Image Id="dfltMask2" TextureId="txr_railway2" Bounds="0, 0, 480, 320" TraceId="image4733"/>
    </Layer>
    <Layer Id="action" BackColor="#FFFFFFFF">
        <Enemy Id="enm1" Class="clsEnemyRat4" Bounds="401, 55, 22, 23" TraceId="image4799"/>
        <Enemy Id="enm2" Class="clsEnemyRat4" Bounds="45, 115, 22, 23" TraceId="image4801"/>
        <Enemy Id="enm3" Class="clsEnemyRat4" Bounds="189, 250, 22, 23" TraceId="image4803"/>
        <Enemy Id="enm4" Class="clsEnemyRat4" Bounds="401, 176, 22, 23" TraceId="image4606"/>
        <Food Id="fd1" Class="clsFoodFish1" Bounds="159, 34, 30, 15" TraceId="image4761"/>
        <Food Id="fd2" Class="clsFoodFish1" Bounds="193, 30, 30, 15" TraceId="image4763"/>
        <Food Id="fd3" Class="clsFoodFish1" Bounds="273, 33, 30, 15" TraceId="image4765"/>
        <Food Id="fd4" Class="clsFoodFish1" Bounds="357, 33, 30, 15" TraceId="image4767"/>
        <Food Id="fd5" Class="clsFoodFish1" Bounds="376, 85, 30, 15" TraceId="image4769"/>
        <Food Id="fd6" Class="clsFoodFish1" Bounds="365, 94, 30, 15" TraceId="image4771"/>
        <Food Id="fd7" Class="clsFoodFish1" Bounds="240, 90, 30, 15" TraceId="image4773"/>
        <Food Id="fd8" Class="clsFoodFish1" Bounds="214, 100, 30, 15" TraceId="image4775"/>
        <Food Id="fd9" Class="clsFoodFish1" Bounds="57, 83, 30, 15" TraceId="image4777"/>
        <Food Id="fd10" Class="clsFoodFish1" Bounds="65, 158, 30, 15" TraceId="image4779"/>
        <Food Id="fd11" Class="clsFoodFish1" Bounds="86, 147, 30, 15" TraceId="image4781"/>
        <Food Id="fd12" Class="clsFoodFish1" Bounds="114, 160, 30, 15" TraceId="image4783"/>
        <Food Id="fd13" Class="clsFoodFish1" Bounds="325, 153, 30, 15" TraceId="image4785"/>
        <Food Id="fd14" Class="clsFoodFish1" Bounds="342, 219, 30, 15" TraceId="image4787"/>
        <Food Id="fd15" Class="clsFoodFish1" Bounds="288, 217, 30, 15" TraceId="image4789"/>
        <Food Id="fd16" Class="clsFoodFish1" Bounds="231, 206, 30, 15" TraceId="image4791"/>
        <Food Id="fd17" Class="clsFoodFish1" Bounds="358, 269, 30, 15" TraceId="image4793"/>
        <Food Id="fd18" Class="clsFoodFish1" Bounds="376, 263, 30, 15" TraceId="image4795"/>
        <Food Id="fd19" Class="clsFoodFish1" Bounds="333, 267, 30, 15" TraceId="image4797"/>
        <Food Id="fd20" Class="clsFoodFish1" Bounds="332, 277, 30, 15" TraceId="image4663"/>
    </Layer>
    <Layer Id="way" BackColor="#FFFFFFFF">
        <!-- HAND EDIT >>> -->
        <SequenceSet Id="setWay" InProgress="true">
            <Do Action="hero.SetTransaction(false, true, true)" />
            <Delay Duration="3" />
            <NumAnimation From="0" To="398" Target="hero.X" Duration="4.74" IsDelta="true" Autoreverse="false" RepeatCount="1" TraceId="image3336"/>
            <NumAnimation From="0" To="60" Target="hero.Y" Duration="0.71" IsDelta="true" Autoreverse="false" RepeatCount="1" TraceId="image3358"/>
            <NumAnimation From="0" To="-416" Target="hero.X" Duration="4.95" IsDelta="true" Autoreverse="false" RepeatCount="1" TraceId="image4747"/>
            <NumAnimation From="0" To="60" Target="hero.Y" Duration="0.71" IsDelta="true" Autoreverse="false" RepeatCount="1" TraceId="image4749"/>
            <NumAnimation From="0" To="416" Target="hero.X" Duration="4.95" IsDelta="true" Autoreverse="false" RepeatCount="1" TraceId="image4753"/>
            <NumAnimation From="0" To="60" Target="hero.Y" Duration="0.71" IsDelta="true" Autoreverse="false" RepeatCount="1" TraceId="image4755"/>
            <NumAnimation From="0" To="-296" Target="hero.X" Duration="3.52" IsDelta="true" Autoreverse="false" RepeatCount="1" TraceId="image3369"/>
            <NumAnimation From="0" To="60" Target="hero.Y" Duration="0.71" IsDelta="true" Autoreverse="false" RepeatCount="1" TraceId="image4757"/>
            <NumAnimation From="0" To="270" Target="hero.X" Duration="3.21" IsDelta="true" Autoreverse="false" RepeatCount="1" TraceId="image4759"/>
        </SequenceSet>
        <BoolTrigger Condition="hero:Enter" EnterAction="setWay.Stop()" />
        <!-- HAND EDIT <<< -->
    </Layer>
    <Layer Id="actionTHE" BackColor="#FFFFFFFF">
        <Tower Id="tower" Bounds="0, 0, 30, 30" Class="clsTower" TraceId="image3038"/>
        <Hero Id="hero" Class="clsHero" Bounds="26, 23, 33, 24" TraceId="image3015"/>
        <Group Id="exit" Class="clsExit" Bounds="428, 235, 37, 54" TraceId="image3049" />
    </Layer>
    <Layer Id="semafor" BackColor="#FFFFFFFF">
        <Include File="includeSemafor.xml" />
        <Image Id="img_semafor_red" TextureId="txr_semafor_red" Bounds="69, 8, 38, 60" TraceId="image3336-1" />
        <Image Id="img_semafor_green" TextureId="txr_semafor_green" Bounds="69, 8, 38, 60" Enabled="false" TraceId="image3336-1" />
    </Layer>
    <Include File="ClassExplosion.xml" />
    <Include File="Dashboard_Poezd_Series.xml" />
</Level>
<!-- Food=20 Enemy=4 Block=0 DesignImage=2 Animation=0 Teleport Animations=0 FoodPack=0 Oil Barrel=0 dealy sec=0 -->
<!-- -->
<!-- Food Points = 1400 -->
<!-- 1% = 14; 45% = 630; 90% = 1260 -->
<!-- minPointsFood = 70 (5%) -->
<!-- -->
<!-- Enemy Points = 200 -->
<!-- 1% = 2; 45% = 90; 90% = 180 -->
<!-- minPointsEnemy = 50 (25%) -->
<!-- -->
<!-- Food + Enemy Points = 1600 -->
<!-- 1% = 16; 45% = 720; 90% = 1440 -->
<!-- minPointsFood = 70 (4.4%) -->
<!-- minPointsEnemy = 50 (3.1%) -->
