<?xml version="1.0" encoding="utf-8"?>
<!-- SVG to XGAME xml converter v1.6.04 -->
<!-- source: D:\Lunohod\Levels\Lvl_1D_Zamanuha_v2\Lvl_1D_Zamanuha_v2.svg -->
<Level xmlns:xsi="http://www.w3.org/2001/XMLSchema-instance" xsi:noNamespaceSchemaLocation="file:///D:/Lunohod/Documentation/schema0.xsd" Name="Lvl_1D_Zamanuha_v2" Bounds="0, 0, 480, 320">
    <Include File="ClassFood.xml" />
    <Include File="ClassTower.xml" />
    <Include File="ClassExit.xml" />
    <Include File="ClassHero.xml" />
    <Resources RootFolder="Textures">
        <Texture Id="txr_brickWall" Source="brickWall" />
        <Texture Id="txr_laz_hor" Source="laz_hor" />
        <Texture Id="txr_laz_bckgrnd" Source="laz_bckgrnd" />
        <Texture Id="txr_fish_5_me" Source="fish_5_me" />
        <Texture Id="txr_container_steel_2" Source="container_steel_2" />
    </Resources>
    <Layer Id="background" BackColor="#FFFFFFFF">
        <Image Id="dfltMask1" TextureId="txr_brickWall" Bounds="0, 0, 480, 320" TraceId="image4550"/>
    </Layer>
    <Layer Id="laz" BackColor="#FFFFFFFF">
        <Image Id="dfltMask2" TextureId="txr_laz_hor" Bounds="160, 60, 40, 30" TraceId="image3109"/>
        <Image Id="dfltMask3" TextureId="txr_laz_bckgrnd" Bounds="220, 70, 40, 30" TraceId="image3035"/>
        <Image Id="dfltMask4" TextureId="txr_laz_bckgrnd" Bounds="260, 70, 40, 30" TraceId="image3056"/>
        <Image Id="dfltMask5" TextureId="txr_laz_bckgrnd" Bounds="260, 100, 40, 30" TraceId="image3058"/>
        <Image Id="dfltMask6" TextureId="txr_laz_bckgrnd" Bounds="220, 100, 40, 30" TraceId="image3060"/>
        <Image Id="dfltMask7" TextureId="txr_laz_bckgrnd" Bounds="300, 70, 40, 30" TraceId="image3063"/>
        <Image Id="dfltMask8" TextureId="txr_laz_bckgrnd" Bounds="300, 100, 40, 30" TraceId="image3066"/>
        <Image Id="dfltMask9" TextureId="txr_laz_bckgrnd" Bounds="180, 70, 40, 30" TraceId="image3068"/>
        <Image Id="dfltMask10" TextureId="txr_laz_bckgrnd" Bounds="180, 100, 40, 30" TraceId="image3070"/>
        <Image Id="dfltMask11" TextureId="txr_laz_bckgrnd" Bounds="220, 40, 40, 30" TraceId="image3072"/>
        <Image Id="dfltMask12" TextureId="txr_laz_bckgrnd" Bounds="260, 40, 40, 30" TraceId="image3074"/>
        <Image Id="dfltMask13" TextureId="txr_laz_bckgrnd" Bounds="300, 40, 40, 30" TraceId="image3076"/>
        <Image Id="dfltMask14" TextureId="txr_laz_bckgrnd" Bounds="180, 40, 40, 30" TraceId="image3078"/>
        <Image Id="dfltMask15" TextureId="txr_laz_bckgrnd" Bounds="260, 130, 40, 30" TraceId="image3080"/>
        <Image Id="dfltMask16" TextureId="txr_laz_bckgrnd" Bounds="220, 130, 40, 30" TraceId="image3082"/>
        <Image Id="dfltMask17" TextureId="txr_laz_bckgrnd" Bounds="300, 130, 40, 30" TraceId="image3084"/>
        <Image Id="dfltMask18" TextureId="txr_laz_bckgrnd" Bounds="180, 130, 40, 30" TraceId="image3086"/>
        <Image Id="dfltMask19" TextureId="txr_laz_hor" Bounds="120, 60, 40, 30" TraceId="image3096"/>
        <Image Id="dfltMask20" TextureId="txr_laz_hor" Bounds="80, 60, 40, 30" TraceId="image3099"/>
        <Image Id="dfltMask21" TextureId="txr_laz_hor" Bounds="40, 60, 40, 30" TraceId="image3101"/>
        <Image Id="dfltMask22" TextureId="txr_laz_hor" Bounds="0, 60, 40, 30" TraceId="image3103"/>
    </Layer>
    <Layer Id="action" BackColor="#FFFFFFFF">
        <Food Id="fd1" Class="clsFood" Points="100" Bounds="295, 136, 26, 17" TraceId="image3111">
            <Image TextureId="txr_fish_5_me" />
        </Food>
        <Food Id="fd2" Class="clsFood" Points="100" Bounds="307, 118, 26, 17" TraceId="image3065">
            <Image TextureId="txr_fish_5_me" />
        </Food>
        <Block Id="blk1" Bounds="266, 70, 30, 30" Edges="Bounce" TraceId="image3071">
            <Image TextureId="txr_container_steel_2" />
        </Block>
        <Block Id="blk2" Bounds="248, 102, 30, 30" Edges="Bounce" TraceId="image3073">
            <Image TextureId="txr_container_steel_2" />
        </Block>
    </Layer>
    <Layer Id="actionTHE" BackColor="#FFFFFFFF">
        <Tower Id="tower" Bounds="0, 0, 30, 30" Class="clsTower" TraceId="image3038"/>
        <Group Id="exit" Class="clsExit" Bounds="183, 104, 37, 54" TraceId="image3049" />
        <Hero Id="hero" Class="clsHero" Bounds="19, 63, 33, 24" TraceId="image3606"/>
    </Layer>
    <Layer Id="blocks" BackColor="#FFFFFFFF">
        <Block Id="blk3" Bounds="-50, 0, 50, 160" Edges="Stick" TraceId="image4576"/>
        <Block Id="blk4" Bounds="-20, 10, 200, 50" Edges="Stick" TraceId="image4579"/>
        <Block Id="blk5" Bounds="340, 0, 50, 160" Edges="Stick" TraceId="image4587"/>
        <Block Id="blk6" Bounds="-20, 90, 200, 166" Edges="Stick" TraceId="image3034"/>
        <Block Id="blk7" Bounds="180, 160, 200, 166" Edges="Stick" TraceId="image3036"/>
        <Block Id="blk8" Bounds="180, -126, 200, 166" Edges="Stick" TraceId="image3039"/>
    </Layer>
    <Include File="ClassExplosion.xml" />
    <Include File="Dashboard.xml" />
</Level>
<!-- Food=2 Enemy=0 Block=8 DesignImage=22 Animation=0 Teleport Animations=0 FoodPack=0 -->
<!-- -->
<!-- Food Points = 200 -->
<!-- 1% = 2; 45% = 90; 90% = 180 -->
<!-- minPointsFood = 100 (50%) -->
